{
  "experiment_id": "replace_with_stable_experiment_id",
  "project_id": "replace_with_project_id",
  "strategy_id": "replace_with_strategy_id",
  "strategy_version": "replace_with_strategy_version",
  "research_stage": "STAGE_0_IDEA",
  "gate": null,
  "title": "Replace with experiment title",
  "experiment_type": "replace_with_type",
  "hypothesis": "Replace with falsifiable hypothesis",
  "description": "Replace with scope and purpose",
  "scope": {"instrument_id": null, "universe_id": null, "asset_class": null, "timeframe": null, "partition": "DEVELOPMENT"},
  "lineage": {"parent_experiment_ids": [], "source_gates": []},
  "reproducibility": {"dataset_id": null, "dataset_version": null, "data_hash": null, "config_path": null, "git_sha": null, "working_tree_dirty": null, "final_git_sha": null, "final_working_tree_dirty": null, "run_timestamp": null},
  "data_references": [],
  "configuration": {"path": null, "parameters": {}},
  "status": "planned",
  "decision": "none",
  "confirmatory": false,
  "reserved_data_exposed": false,
  "summary_metrics": {},
  "artifacts": [],
  "started_at": null,
  "updated_at": null,
  "completed_at": null,
  "failed_at": null,
  "failure": null,
  "runtime_metadata": {},
  "registration": {"api_version": "1.0", "record_path": null},
  "notes": null,
  "known_limitations": []
}
